{
  "format": "mathaudit-qualification-publication-data-v0.1",
  "tool_version": "0.2.1",
  "source_plan_sha256": "c246d426ca8b06e01546d9c3d276c29b1ae81de682bdf33cfaa7edb1573b1c18",
  "analysis_config_raw_sha256": "bacb9aa4cc0d28311829bc9b8ed20a206b19ca6aca6eaef25907bb4f2b15a549",
  "label_variants": [
    "deterministic"
  ],
  "analysis_inputs": [
    {
      "label_variant": "deterministic",
      "analysis_sha256": "26e5c3035f289cc79378bd6feb19d3b34a3058f0f48f8b153b89950bc73ba5dd",
      "raw_sha256": "9581464e59990d340b5de4023792bfa3aa48cdcabc839b2f9bf4bc648aa13334"
    }
  ],
  "table_row_counts": {
    "availability": 86,
    "cost": 86,
    "exact_pairwise": 12,
    "source_type_pairwise": 36,
    "cofailure": 4,
    "transitions": 4,
    "utilization": 4,
    "text_repetition": 2,
    "effective_support": 6,
    "final_outcomes": 6
  },
  "primary_figure_label_variant": "deterministic",
  "system_ranking_computed": false,
  "data_sha256": "915267611f5f9f946a45691fd9432816e3842e82591f32e6280d222d47fe03a2"
}
